{
  "header": {
    "number": 6,
    "previous_hash": "j7883yWIgQJhG6sICj6nma/fYeJS1CY4wZKZx4U0+B8=",
    "data_hash": "rvmwmM9tzKoPOoWqbwiZlAXTcYUdUigoVC+4WDsbXWg="
  },
  "transactions": [
    {
      "signature": "MEQCIAKcLtI4Z+MHco+muVUxXnlF49lgmQcHDybxElyaHAPFAiAu3qdvLEakbyduhOz6gm54jVGydIrqDNJBopOxWh6WjA==",
      "channel_header": {
        "type": 3,
        "timestamp": {
          "seconds": 1494408478,
          "nanos": 82512480
        },
        "channel_id": "ch1",
        "tx_id": "dd45daabe210430c5dc59eaa2fb1adefaeb18cc4001b24500acc1e60af22c730",
        "chaincode_id": {
          "name": "mycc1",
          "version": "0"
        }
      },
      "signature_header": {
        "Certificate": {
          "Raw": "MIICizCCAjKgAwIBAgIUBEVwsSx0TmqdbzNwleNBBzoIT0wwCgYIKoZIzj0EAwIwfzELMAkGA1UEBhMCVVMxEzARBgNVBAgTCkNhbGlmb3JuaWExFjAUBgNVBAcTDVNhbiBGcmFuY2lzY28xHzAdBgNVBAoTFkludGVybmV0IFdpZGdldHMsIEluYy4xDDAKBgNVBAsTA1dXVzEUMBIGA1UEAxMLZXhhbXBsZS5jb20wHhcNMTYxMTExMTcwNzAwWhcNMTcxMTExMTcwNzAwWjBjMQswCQYDVQQGEwJVUzEXMBUGA1UECBMOTm9ydGggQ2Fyb2xpbmExEDAOBgNVBAcTB1JhbGVpZ2gxGzAZBgNVBAoTEkh5cGVybGVkZ2VyIEZhYnJpYzEMMAoGA1UECxMDQ09QMFkwEwYHKoZIzj0CAQYIKoZIzj0DAQcDQgAEHBuKsAO43hs4JGpFfiGMkB/xsILTsOvmN2WmwpsPHZNL6w8HWe3xCPQtdG/XJJvZ+C756KEsUBM3yw5PTfku8qOBpzCBpDAOBgNVHQ8BAf8EBAMCBaAwHQYDVR0lBBYwFAYIKwYBBQUHAwEGCCsGAQUFBwMCMAwGA1UdEwEB/wQCMAAwHQYDVR0OBBYEFOFCdcUZ4es3ltiCgAVDoyLfVpPIMB8GA1UdIwQYMBaAFBdnQj2qnoI/xMUdn1vDmdG1nEgQMCUGA1UdEQQeMByCCm15aG9zdC5jb22CDnd3dy5teWhvc3QuY29tMAoGCCqGSM49BAMCA0cAMEQCIDf9Hbl4xn3z4EwNKmilM9lX2Fq4jWpAaRVB97OmVEeyAiAkaXzB/jnlU39B7Wws9BIr9c8mSOEPF6VY1uGP+dKV0g==",
          "RawTBSCertificate": "MIICMqADAgECAhQERXCxLHROap1vM3CV40EHOghPTDAKBggqhkjOPQQDAjB/MQswCQYDVQQGEwJVUzETMBEGA1UECBMKQ2FsaWZvcm5pYTEWMBQGA1UEBxMNU2FuIEZyYW5jaXNjbzEfMB0GA1UEChMWSW50ZXJuZXQgV2lkZ2V0cywgSW5jLjEMMAoGA1UECxMDV1dXMRQwEgYDVQQDEwtleGFtcGxlLmNvbTAeFw0xNjExMTExNzA3MDBaFw0xNzExMTExNzA3MDBaMGMxCzAJBgNVBAYTAlVTMRcwFQYDVQQIEw5Ob3J0aCBDYXJvbGluYTEQMA4GA1UEBxMHUmFsZWlnaDEbMBkGA1UEChMSSHlwZXJsZWRnZXIgRmFicmljMQwwCgYDVQQLEwNDT1AwWTATBgcqhkjOPQIBBggqhkjOPQMBBwNCAAQcG4qwA7jeGzgkakV+IYyQH/GwgtOw6+Y3ZabCmw8dk0vrDwdZ7fEI9C10b9ckm9n4LvnooSxQEzfLDk9N+S7yo4GnMIGkMA4GA1UdDwEB/wQEAwIFoDAdBgNVHSUEFjAUBggrBgEFBQcDAQYIKwYBBQUHAwIwDAYDVR0TAQH/BAIwADAdBgNVHQ4EFgQU4UJ1xRnh6zeW2IKABUOjIt9Wk8gwHwYDVR0jBBgwFoAUF2dCPaqegj/ExR2fW8OZ0bWcSBAwJQYDVR0RBB4wHIIKbXlob3N0LmNvbYIOd3d3Lm15aG9zdC5jb20=",
          "RawSubjectPublicKeyInfo": "MFkwEwYHKoZIzj0CAQYIKoZIzj0DAQcDQgAEHBuKsAO43hs4JGpFfiGMkB/xsILTsOvmN2WmwpsPHZNL6w8HWe3xCPQtdG/XJJvZ+C756KEsUBM3yw5PTfku8g==",
          "RawSubject": "MGMxCzAJBgNVBAYTAlVTMRcwFQYDVQQIEw5Ob3J0aCBDYXJvbGluYTEQMA4GA1UEBxMHUmFsZWlnaDEbMBkGA1UEChMSSHlwZXJsZWRnZXIgRmFicmljMQwwCgYDVQQLEwNDT1A=",
          "RawIssuer": "MH8xCzAJBgNVBAYTAlVTMRMwEQYDVQQIEwpDYWxpZm9ybmlhMRYwFAYDVQQHEw1TYW4gRnJhbmNpc2NvMR8wHQYDVQQKExZJbnRlcm5ldCBXaWRnZXRzLCBJbmMuMQwwCgYDVQQLEwNXV1cxFDASBgNVBAMTC2V4YW1wbGUuY29t",
          "Signature": "MEQCIDf9Hbl4xn3z4EwNKmilM9lX2Fq4jWpAaRVB97OmVEeyAiAkaXzB/jnlU39B7Wws9BIr9c8mSOEPF6VY1uGP+dKV0g==",
          "SignatureAlgorithm": 10,
          "PublicKeyAlgorithm": 3,
          "PublicKey": {
            "Curve": {
              "P": 115792089210356248762697446949407573530086143415290314195533631308867097853951,
              "N": 115792089210356248762697446949407573529996955224135760342422259061068512044369,
              "B": 41058363725152142129326129780047268409114441015993725554835256314039467401291,
              "Gx": 48439561293906451759052585252797914202762949526041747995844080717082404635286,
              "Gy": 36134250956749795798585127919587881956611106672985015071877198253568414405109,
              "BitSize": 256,
              "Name": "P-256"
            },
            "X": 12713421817418932763413718645318291131658429549618161805148108180370161081747,
            "Y": 34338776428353405405758244684264567987888272761951209233206748157655345868530
          },
          "Version": 3,
          "SerialNumber": 24384531367087201972415224946499269301170097996,
          "Issuer": {
            "Country": [
              "US"
            ],
            "Organization": [
              "Internet Widgets, Inc."
            ],
            "OrganizationalUnit": [
              "WWW"
            ],
            "Locality": [
              "San Francisco"
            ],
            "Province": [
              "California"
            ],
            "StreetAddress": null,
            "PostalCode": null,
            "SerialNumber": "",
            "CommonName": "example.com",
            "Names": [
              {
                "Type": [
                  2,
                  5,
                  4,
                  6
                ],
                "Value": "US"
              },
              {
                "Type": [
                  2,
                  5,
                  4,
                  8
                ],
                "Value": "California"
              },
              {
                "Type": [
                  2,
                  5,
                  4,
                  7
                ],
                "Value": "San Francisco"
              },
              {
                "Type": [
                  2,
                  5,
                  4,
                  10
                ],
                "Value": "Internet Widgets, Inc."
              },
              {
                "Type": [
                  2,
                  5,
                  4,
                  11
                ],
                "Value": "WWW"
              },
              {
                "Type": [
                  2,
                  5,
                  4,
                  3
                ],
                "Value": "example.com"
              }
            ],
            "ExtraNames": null
          },
          "Subject": {
            "Country": [
              "US"
            ],
            "Organization": [
              "Hyperledger Fabric"
            ],
            "OrganizationalUnit": [
              "COP"
            ],
            "Locality": [
              "Raleigh"
            ],
            "Province": [
              "North Carolina"
            ],
            "StreetAddress": null,
            "PostalCode": null,
            "SerialNumber": "",
            "CommonName": "",
            "Names": [
              {
                "Type": [
                  2,
                  5,
                  4,
                  6
                ],
                "Value": "US"
              },
              {
                "Type": [
                  2,
                  5,
                  4,
                  8
                ],
                "Value": "North Carolina"
              },
              {
                "Type": [
                  2,
                  5,
                  4,
                  7
                ],
                "Value": "Raleigh"
              },
              {
                "Type": [
                  2,
                  5,
                  4,
                  10
                ],
                "Value": "Hyperledger Fabric"
              },
              {
                "Type": [
                  2,
                  5,
                  4,
                  11
                ],
                "Value": "COP"
              }
            ],
            "ExtraNames": null
          },
          "NotBefore": "2016-11-11T17:07:00Z",
          "NotAfter": "2017-11-11T17:07:00Z",
          "KeyUsage": 5,
          "Extensions": [
            {
              "Id": [
                2,
                5,
                29,
                15
              ],
              "Critical": true,
              "Value": "AwIFoA=="
            },
            {
              "Id": [
                2,
                5,
                29,
                37
              ],
              "Critical": false,
              "Value": "MBQGCCsGAQUFBwMBBggrBgEFBQcDAg=="
            },
            {
              "Id": [
                2,
                5,
                29,
                19
              ],
              "Critical": true,
              "Value": "MAA="
            },
            {
              "Id": [
                2,
                5,
                29,
                14
              ],
              "Critical": false,
              "Value": "BBThQnXFGeHrN5bYgoAFQ6Mi31aTyA=="
            },
            {
              "Id": [
                2,
                5,
                29,
                35
              ],
              "Critical": false,
              "Value": "MBaAFBdnQj2qnoI/xMUdn1vDmdG1nEgQ"
            },
            {
              "Id": [
                2,
                5,
                29,
                17
              ],
              "Critical": false,
              "Value": "MByCCm15aG9zdC5jb22CDnd3dy5teWhvc3QuY29t"
            }
          ],
          "ExtraExtensions": null,
          "UnhandledCriticalExtensions": null,
          "ExtKeyUsage": [
            1,
            2
          ],
          "UnknownExtKeyUsage": null,
          "BasicConstraintsValid": true,
          "IsCA": false,
          "MaxPathLen": -1,
          "MaxPathLenZero": false,
          "SubjectKeyId": "4UJ1xRnh6zeW2IKABUOjIt9Wk8g=",
          "AuthorityKeyId": "F2dCPaqegj/ExR2fW8OZ0bWcSBA=",
          "OCSPServer": null,
          "IssuingCertificateURL": null,
          "DNSNames": [
            "myhost.com",
            "www.myhost.com"
          ],
          "EmailAddresses": null,
          "IPAddresses": null,
          "PermittedDNSDomainsCritical": false,
          "PermittedDNSDomains": null,
          "CRLDistributionPoints": null,
          "PolicyIdentifiers": null
        },
        "nonce": "P1te+7havgFJXCqcr0r7e8Eexc73iSo7"
      },
      "tx_action_signature_header": {
        "Certificate": {